_id,created_at,favorite_count,lang,retweet_count,text,user_descreption,user_favourites_count,user_followers_count,user_friends_count,user_location,user_name
62a9fa7e0773fd56d77ef218,Wed Jun 15 14:13:21 +0000 2022,0,en,0, jobs with titles like maintenance technician villa vincent crookston sound appealing you follow ,Follow this account for geo-targeted Supply Chain job tweets in Minnesota Non-Metro. Need help? Tweet us at @CareerArc!,0,222,193,Minnesota,Minnesota S-Chain
62a9fa7e0773fd56d77ef219,Wed Jun 15 14:13:03 +0000 2022,1,en,1, june the uflpa will deny the import products from the xinjang region china placing the burden ,Moving as one™,476,6822,4846,"Austin, TX",e2open
62a9fa7e0773fd56d77ef21a,Wed Jun 15 14:12:59 +0000 2022,0,en,0, your business using rfid you already winning rfidtechnology assetmanagement logistics supplychain ,National Office Systems is the leading provider of high density shelving and armory management systems.,448,461,1135,Washington DC,Joe Alvarez
62a9fa7e0773fd56d77ef21b,Wed Jun 15 14:12:31 +0000 2022,0,en,0,this supplychain job might great fit for you click the link our bio see and more inventory crew ,"Follow this account for geo-targeted Supply Chain job tweets in Dayton, OH. Need help? Tweet us at @CareerArc!",0,301,188,"Dayton, OH",Dayton S-Chain
62a9fa7e0773fd56d77ef21c,Wed Jun 15 14:10:36 +0000 2022,0,en,5, can the printing books more sustainable you bet maverick senior associate simon crump new post reveals simp ,Publishing consultancy specialising in digital workflows for scholarly and academic publishers,429,102,117,"Richmond, England",Green Fifteen
62a9fa7e0773fd56d77ef21d,Wed Jun 15 14:10:11 +0000 2022,0,en,0,stop staring the clock every day time for new career follow view jobs with titles like customer ,"Follow this account for geo-targeted Supply Chain job tweets in Cleveland, OH. Need help? Tweet us at @CareerArc!",0,230,203,"Cleveland, OH",ClevelandOH S-Chain
62a9fa7e0773fd56d77ef21e,Wed Jun 15 14:09:55 +0000 2022,1,en,0,investment automated handling and storage brings host benefits for largest independent wine store ,"Latest Shipping & Freight News, Information + Videos from around the world. #Shipping #Freight #Logistics #Trucking #SupplyChain #AirCargo #Maritime #SeaFreight",4,142,547,,Shipping & Freight Updates
62a9fa7e0773fd56d77ef21f,Wed Jun 15 14:09:05 +0000 2022,0,en,0,this whitepaper summary the most important points relevant the automotive supplychain voiced leadi ,"One Network is the global leader in supply chain control towers, and provider of the Digital Supply Chain Network™ enabling autonomous supply chain management.",699,3713,3375,"Dallas, TX, USA",One Network Enterprises
62a9fa7e0773fd56d77ef220,Wed Jun 15 14:08:57 +0000 2022,0,en,1, transportation amp supplychain execs should pay attention the metaverse asserts new blog pos ,"♻️I auto-retweet #VirtualReality tweets!

⚠️NSFW tweets filtered but still possible as Auto-Retweet

🔖Find #VR reviews➡️@NookSite

💻Built by➡️@NookSite",425,4116,1,Metaverse,VR Retweeter
62a9fa7e0773fd56d77ef221,Wed Jun 15 14:08:56 +0000 2022,0,en,1, how blockchain helping the supplychain has good look the role blockchain tech playing including ,Publisher at the Institution of Engineering and Technology. Technology and blockchain and sustainability enthusiast.,1417,62,535,"London, England",Kruna Vukmirovic
62a9fa7e0773fd56d77ef222,Wed Jun 15 14:08:36 +0000 2022,0,en,3, our procurement and supplychain solutions yash gives breakdown some the most insightful topics seen ,"The latest in the Infonomics® brand of healthcare management consulting powered by https://t.co/koH9oNiIkm
#Infonomics",1,3658,3540,"Palos Verdes Estates, CA",Infonomics®
62a9fa7e0773fd56d77ef223,Wed Jun 15 14:08:35 +0000 2022,0,en,3, our procurement and supplychain solutions yash gives breakdown some the most insightful topics seen ,"Putting the Social in Supply Chain. The gathering place to collaborate, share information and leverage the Social Network for Supply Chain in Healthcare.",3,2045,1806,,Supply Chain Social Network
62a9fa7e0773fd56d77ef224,Wed Jun 15 14:08:31 +0000 2022,0,en,1, this 𝐏𝐡𝐃 𝐒𝐮𝐦𝐦𝐞𝐫 𝐀𝐜𝐚𝐝𝐞𝐦𝐲 edition continues with the outstanding session 𝐶𝑜𝑚𝑝𝑒𝑡𝑖𝑡𝑖𝑜𝑛 𝑎𝑛𝑑 𝐶𝑜𝑜𝑝𝑒𝑟𝑎𝑡𝑖𝑜𝑛 𝑆𝑢𝑝𝑝𝑙𝑦 ,Director del Master en Dirección de la Cadena de Suministro (MDSC) del Zaragoza Logistics Center,465,473,1421,Zaragoza,M.A. García
62a9fa7e0773fd56d77ef225,Wed Jun 15 14:08:16 +0000 2022,0,en,0, stay ahead supplychain disruptions amp keep with ever evolving customer demands time transform you ,PositiveEdge is a global business technology company specializing in the implementation of CRM products and services.,8,36,167,"Newark, California",PositiveEdge Solutions
62a9fa7e0773fd56d77ef226,Wed Jun 15 14:08:01 +0000 2022,0,en,0,what the typical supply chain journey for vegetables grown traditional farm how does that differ from ,We’re changing the way we farm produce and feed people with sustainable vertical farming technology.,74,476,16,"Cleburne, TX",Eden Green Technology
62a9fa7e0773fd56d77ef227,Wed Jun 15 14:07:38 +0000 2022,0,en,0, maximize supplychain performance complexity and unpredictable variables each stage delivery journey ,A @UPS Company making 1-2 day delivery easy and affordable for businesses of all sizes with our on‑demand warehousing and fulfillment technology. 📦,469,291,441,"Atlanta, GA",Ware2Go | Fulfillment Services
62a9fa7e0773fd56d77ef228,Wed Jun 15 14:07:23 +0000 2022,0,en,1, with global supplychain bottlenecks unlikely resolve themselves soon firms have turned their attention reshorin ,"✊💗🇮🇱
חירות אפשר לקחת רק מאנשים שמוכנים לוותר עליה
Freedom can be taken only from people willing to give it up",6746,682,126,Online,Oren Simon - אורן סימון
62a9fa7e0773fd56d77ef229,Wed Jun 15 14:07:14 +0000 2022,0,es,2, qué les parecería space para hablar sobre crisis mundial cadena suministro twitterspace twi ,,14680,1061,1446,,Abraham K. Weller
62a9fa7e0773fd56d77ef22a,Wed Jun 15 14:07:11 +0000 2022,0,en,2, every tweet post help create jobs for americans and boost manufacturing buy american for america ,Currently researching on my theory of the various circumstances that preclude some people to allow themselves to get drawn into (The Circle of Friends Effect).,109607,2605,5006,Central Ohio ,Steven C Rechel
62a9fa7e0773fd56d77ef22b,Wed Jun 15 14:06:52 +0000 2022,0,en,8, for those doing business with china starting next tuesday goods sourced mined produced manufactured who ,"Legal Analyst @BLaw. Texan, #antitrust geek, dynamite cook, art junkie. Opinions my own, retweets are not endorsements.",50467,827,914,,Eleanor Tyler
62a9fa7e0773fd56d77ef22c,Wed Jun 15 14:06:15 +0000 2022,0,en,0, gov may ban imports made forced labour and gov has and enforces and working with canada and mexico ,"HumanRights Sustainability ESG & in SupplyChains esp EthicalFashion Advocacy. Wrkd China Asia 11ys, speak Chinese. Articles, podcast, etc https://t.co/vF84Yegr2w",192041,4134,4971,London,Kate Larsen 李可婷
62a9fa7e0773fd56d77ef22d,Wed Jun 15 14:06:08 +0000 2022,1,en,0,working transform tomorrow today discover empowerment foresight innovation learn more ,“Don’t judge me by my successes; judge me for how many times I have fallen and gotten back up.”                   https://t.co/BJFBYoEiFE,950,100,108,United States,Lionstar
62a9fa7e0773fd56d77ef22e,Wed Jun 15 14:05:33 +0000 2022,1,en,0,fedex ups dividends they can put money the company operations regain lost market position spend ,Supply Chain/Logistics consultant & advisor. I draw on real end-to-end SCM experience. Penn Stater. Ice coffee drinker. I agree with me. Email: tomc@ltdmgmt.com,61099,1371,740,"Lehigh Valley, PA",Tom Craig
62a9fa7e0773fd56d77ef22f,Wed Jun 15 14:05:33 +0000 2022,0,en,0,the sleek four wheeled carts look familiar enough but not even ups knows precisely how describe what could ,Covering Canada's Supply Chain for Over 60 Years (formerly PurchasingB2B). Print edition relaunches with December 2018 issue. Online at https://t.co/NrPuVEJRlV.,587,1805,1562,"Toronto, ON",Supply Professional magazine
62a9fa7e0773fd56d77ef230,Wed Jun 15 14:04:50 +0000 2022,0,en,7, insulin shortage might next supply chain crisis foxnews insulin supplychain diabetes ,"Old retired Nurse 
Wife, Mom and Grandma, Married to an old retired Marine ❤🇺🇸💙",70511,741,1055,"Cowtown,  Texas",valgal
62a9fa7e0773fd56d77ef231,Wed Jun 15 14:04:22 +0000 2022,0,en,8, for those doing business with china starting next tuesday goods sourced mined produced manufactured who ,"Team Lead-Data, Legal Analytics & Business (DataLAB) @BLaw. Dog person, marathoner, lover of books, food & craft beer, Opinions (and errors) are mine. She/her",1999,689,968,Northern VA,Molly Huie
62a9fa7e0773fd56d77ef232,Wed Jun 15 14:03:58 +0000 2022,0,en,1, transportation amp supplychain execs should pay attention the metaverse asserts new blog ,"We blend advanced analytics, data science, software development and management consulting to help organizations transform their performance.",215,96,120,"Princeton, NJ and New York, NY",PrincetonConsultants
62a9fa7e0773fd56d77ef233,Wed Jun 15 14:03:43 +0000 2022,0,en,0, massive amount appointment announcements for bell flavors amp fragrances see the list promotions below ,The Resource for Sensory and Wellness Innovation.,577,4171,101,,Perfumer & Flavorist+ Magazine
62a9fa7e0773fd56d77ef234,Wed Jun 15 14:03:41 +0000 2022,0,en,0, catch with katie seawell cco get her thoughts cea trends amp learn more about bowery ,"Premier agricultural trade show & conference for Indoor|Vertical Farming, Controlled Environment Agriculture industry",2462,9087,1354, ,Indoor Ag-Con
62a9fa7e0773fd56d77ef235,Wed Jun 15 14:03:28 +0000 2022,0,en,3, thanks craig hillier paul and sean harapko from for joining the ceoleadershipcouncil for enlightening disc ,"Pres & CEO, Global Business Alliance @GlobalBiz - Assn. of American Companies with Global Heritage. Tweets my own.",1430,667,666,"Washington, DC",Nancy McLernon
62a9fa7e0773fd56d77ef236,Wed Jun 15 14:03:24 +0000 2022,0,en,0, rooted commitment creating value for artisanal and small scale miners and their communities find out how ,"Supporting global business, farmers and communities to tackle environmental and social challenges around the world since 1999. 🪱🍃🌏👨‍🌾",2985,4756,2492,Worldwide,Earthworm Foundation
62a9fa7e0773fd56d77ef237,Wed Jun 15 14:03:04 +0000 2022,0,en,0,every company has faced challenges that come with interrupted supply chain recognize supplychain disruption ,"Custom provider of printed electronics, asset identification solutions, metal nameplates, labels, overlays, membrane switches, touchscreens, and HMI devices.",159,227,263,"Youngstown, OH",The Cubbison Company
62a9fa7e0773fd56d77ef238,Wed Jun 15 14:02:20 +0000 2022,0,en,0,cvs health hiring lavista click the link our bio apply delivery driver grand island area supplychain,"Follow this account for geo-targeted Supply Chain job tweets in Omaha, NE. Need help? Tweet us at @CareerArc!",0,231,187,"Omaha, NE",Omaha S-Chain
62a9fa7e0773fd56d77ef239,Wed Jun 15 14:02:04 +0000 2022,0,en,0, rivian pushes back deliveries its ssuv once again engadget electricvehicle ,Just a simple country boy doing the best I can in the big city! I #followback,7685,25032,18735,"Houston, TX",Harold Gardner
62a9fa7e0773fd56d77ef23a,Wed Jun 15 14:01:40 +0000 2022,0,en,7, insulin shortage might next supply chain crisis foxnews insulin supplychain diabetes ,"Professor Medicine @nyulangone, nothing opinion of employer, Medical Director NYUDoctorRadio @SiriusXm https://t.co/lxpc32hlz3 @foxnews contributor",14179,36308,634,,Marc Siegel MD
62a9fa7e0773fd56d77ef23b,Wed Jun 15 14:01:09 +0000 2022,0,en,2, every tweet post help create jobs for americans and boost manufacturing buy american for america ,History of crime organized and not so much. Co Writer of Life and Times of Frank Balistrieri The Last Most Powerful Godfather of Milwaukee,127180,3333,2445,Around ,Mr. Big
62a9fa7e0773fd56d77ef23c,Wed Jun 15 14:00:53 +0000 2022,0,en,0,with the continued rise ecommerce most businesses need rethink advance their operations stay top ,Advancing warehouse operations to drive greater efficiency and productivity for more than 30 years. | An Alta Material Handling Company.,4,521,205,"Midlothian, Virginia",PeakLogix
62a9fa7e0773fd56d77ef23d,Wed Jun 15 14:00:51 +0000 2022,1,en,0,did you know trustedtrucks you can check quotes against powered pricing engine make sure you are ,A transparent and easy-to-use Carrier Qualification Platform.,79,26,42,Germany,TrustedTrucks
62a9fa7e0773fd56d77ef23e,Wed Jun 15 14:00:33 +0000 2022,0,en,0, your supply chain struggling return normal operations after disruption join our upcoming webinar lea ,Gain #logistics & #supplychain visibility with the most advanced real-time #tracking platform.,2853,7533,6914,"Chicago, IL",FourKites
62a9fa7e0773fd56d77ef23f,Wed Jun 15 14:00:25 +0000 2022,0,en,0, procurement are always the lookout for the best deal can get for businesses looking add retain ,"#GoProcure is a procurement solutions company, transforming disorganized purchasing activity into business insights leveraging AI and machine learning",48,107,108,"Duluth, GA",GoProcure
62a9fa7e0773fd56d77ef240,Wed Jun 15 14:00:10 +0000 2022,0,en,0, resilient supply chain not only forecasts and anticipates disruptions but also responds quickly operational ,"Industry-specific ERP solutions for manufacturers, distributors, & retailers/eCommerce. An eWorkplace Manufacturing solution & SAP’s strategic industry partner.",67,148,246,"US, Latin America, Asia",OptiProERP Software
62a9fa7e0773fd56d77ef241,Wed Jun 15 14:00:02 +0000 2022,0,it,0, porto koper aumentato propria capacità movimentazione container molo del arrivando ,"Siamo un'azienda che si occupa di servizi di logistica, trasporti, spedizioni e di assistenza alle imprese nel settore del commercio internazionale.",10,45,64,"Rome, Lazio",Barbarini & Foglia s.r.l.
62a9fa7e0773fd56d77ef242,Wed Jun 15 14:00:01 +0000 2022,0,en,0,how are medicaldevice firms tackling supplychain issues mdt medtronic slowdown surgical business due ,"Dividend strategy for high yield, growth, safety, blend, monthly income, sector focus, capture trading. Home to Payout, free weekly dividend newsletter.",136,5561,256,"New York, NY",Dividend.com
62a9fa7e0773fd56d77ef243,Wed Jun 15 14:00:01 +0000 2022,2,en,2,every tweet post help create jobs for americans and boost manufacturing buy american for america ,Est. 1998 - Pioneering Leaders of The Buy American Movement. Our Mission is to create jobs for Americans promote & support products #BuyAmerican #MadeinUSA #USA,29332,52369,39608,Missouri USA,The Buy American Movement - BuyDirectUSA ❤️🇺🇸
62a9fa7e0773fd56d77ef244,Wed Jun 15 13:59:26 +0000 2022,0,en,8, for those doing business with china starting next tuesday goods sourced mined produced manufactured who ,"Legal Analyst with @BLaw, focusing on #Laborlaw and #Employmentlaw. Opinions are my own, RTs ≠ Endorsements.",890,169,178,"Washington, DC",Francis Boustany
62a9fa7e0773fd56d77ef245,Wed Jun 15 13:57:36 +0000 2022,0,en,0, ddiinstructor leïla bouhali leads demand driven planner ddp session with the ddbrix simulation legrand ,"The Demand Driven Institute (DDI) was founded by Carol Ptak & Chad Smith.  DDI is the world leader in Demand Driven education, training and compliance.",272,1304,4638,,Demand Driven Inst
62a9fa7e0773fd56d77ef246,Wed Jun 15 13:57:12 +0000 2022,0,en,0,latest information germany ports read more here supplychain oceanfreight ,"Supporting businesses around the globe with customized Supply Chain Solutions, Intermodal Transportation and Warehousing",950,1424,721,"Houston, TX",Crane Worldwide Logistics
62a9fa7e0773fd56d77ef247,Wed Jun 15 13:56:46 +0000 2022,0,en,0,large retailers with deep pockets have weathered the past two years better than smes this presents supplychain ,Supply Chain/Logistics consultant & advisor. I draw on real end-to-end SCM experience. Penn Stater. Ice coffee drinker. I agree with me. Email: tomc@ltdmgmt.com,61099,1371,740,"Lehigh Valley, PA",Tom Craig
62a9fa7e0773fd56d77ef248,Wed Jun 15 13:56:29 +0000 2022,0,en,0,can you recommend anyone for this supplychain job doral click the link our bio see and more lea ,"Follow this account for geo-targeted Supply Chain job tweets in Miami, FL. Need help? Tweet us at @CareerArc!",0,239,202,"Miami, FL",MiamiFL S-Chain
62a9fa7e0773fd56d77ef249,Wed Jun 15 13:56:29 +0000 2022,1,en,1, how are going make your life better there are many ways our know how experts spoke about supplychain ,Eclipse Automation works with leading manufacturers across industries to design and build automation solutions for products that change the world.,895,808,266,"Cambridge, Ontario",Eclipse Automation
62a9fa7e0773fd56d77ef24a,Wed Jun 15 13:55:59 +0000 2022,0,en,0,check out our latest supplychain openings tennessee clicking the link our bio ,Follow this account for geo-targeted Supply Chain job tweets in Tennessee Non-Metro. Need help? Tweet us at @CareerArc!,0,235,194,Tennessee,Tennessee S-Chain
62a9fa7e0773fd56d77ef24b,Wed Jun 15 13:55:44 +0000 2022,0,en,8, for those doing business with china starting next tuesday goods sourced mined produced manufactured who ,"@BLaw's Director of Analysis | @haverfordedu | @WashULaw | @smithschool
@BLaw Analysts: https://t.co/MRRMeNhduv
⚾️ & ☕
RT ≠ endorsements",12537,3171,5326,"Washington, DC",Kristyn Hyland
62a9fa7e0773fd56d77ef24c,Wed Jun 15 13:55:32 +0000 2022,0,en,0,new job planning manager location cumbria salary kpa kpa jobs supplychain logistics,"For our official Twitter follow @Cast_UK Find the latest roles in Business Change & Transformation, HR, Procurement, Buying, Supply Chain and Logistics here.",155,374,937,"Manchester, Birmingham, London",Cast UK Jobs
62a9fa7e0773fd56d77ef24d,Wed Jun 15 13:55:24 +0000 2022,0,en,0,supply chain team leader worcester confidential supplychainjobs supplychain supplychaincareers ,"Thousands of top Procurement & Supply Chain jobs posted every week from the world's leading employers. Search, apply and upload your CV today. Free to register.",196,10849,48,"Islington, London",Supply Chain Online
62a9fa7e0773fd56d77ef24e,Wed Jun 15 13:55:23 +0000 2022,0,en,0,head supply chain united kingdom confidential supplychainjobs supplychain supplychaincareers ,"Thousands of top Procurement & Supply Chain jobs posted every week from the world's leading employers. Search, apply and upload your CV today. Free to register.",196,10849,48,"Islington, London",Supply Chain Online
62a9fa7e0773fd56d77ef24f,Wed Jun 15 13:55:23 +0000 2022,0,en,0,supplier quality engineer surrey confidential supplychainjobs supplychain supplychaincareers ,"Thousands of top Procurement & Supply Chain jobs posted every week from the world's leading employers. Search, apply and upload your CV today. Free to register.",196,10849,48,"Islington, London",Supply Chain Online
62a9fa7e0773fd56d77ef250,Wed Jun 15 13:55:23 +0000 2022,0,en,0,supply chain analyst lancashire speedy support services ltd supplychainjobs supplychain supplychaincareers ,"Thousands of top Procurement & Supply Chain jobs posted every week from the world's leading employers. Search, apply and upload your CV today. Free to register.",196,10849,48,"Islington, London",Supply Chain Online
62a9fa7e0773fd56d77ef251,Wed Jun 15 13:55:23 +0000 2022,0,en,0,materials handler peterborough choice rec supplychainjobs supplychain supplychaincareers ,"Thousands of top Procurement & Supply Chain jobs posted every week from the world's leading employers. Search, apply and upload your CV today. Free to register.",196,10849,48,"Islington, London",Supply Chain Online
62a9fa7e0773fd56d77ef252,Wed Jun 15 13:55:23 +0000 2022,0,en,0,regional supplier manager reading concept resourcing supplychainjobs supplychain supplychaincareers ,"Thousands of top Procurement & Supply Chain jobs posted every week from the world's leading employers. Search, apply and upload your CV today. Free to register.",196,10849,48,"Islington, London",Supply Chain Online
62a9fa7e0773fd56d77ef253,Wed Jun 15 13:55:19 +0000 2022,0,en,0, have supplychain jobs open today dfw check them out via the link our bio ,"Follow this account for geo-targeted Supply Chain job tweets in DFW, Texas. Need help? Tweet us at @CareerArc!",0,268,197,"DFW, Texas",Dallas S-Chain
62a9fa7e0773fd56d77ef254,Wed Jun 15 13:55:18 +0000 2022,0,en,0,become supply chain leader read the books supplychain ,CEO Apollo Solutions. Professor. Multi-Genre author.13 books on Amazon. Leadership by Storytelling. Lean & Six Sigma Black Belt. Navy Supply Corps Captain Retd.,287,2820,2520,"Wisconsin, USA",Dr Tom DePaoli
62a9fa7e0773fd56d77ef255,Wed Jun 15 13:55:03 +0000 2022,0,en,6, the impact artificial intelligence injection molding artificialintelligence technology machinelearning deeplear ,"Data Scientist by day, geek tech gamer junky by night

Posts and retweets do not necessarily reflect my views or opinions... usually it's my bot misbehaving",33703,9799,10383,interwebs,iGeek
62a9fa7e0773fd56d77ef256,Wed Jun 15 13:54:32 +0000 2022,0,en,0, healthcare increasingly embraces digital transformation and employs more modern data strategies predictive and ,"New England's leading ISO certified provider of Printing, Kitting, Mailing and Fulfillment services...since 1948.",12,247,311,"Cranston, Rhode Island, USA",The Allied Group
62a9fa7e0773fd56d77ef257,Wed Jun 15 13:54:10 +0000 2022,0,en,0,don shy score job like warehouse pharmacy order selector cvs health asking for referrals ,"Follow this account for geo-targeted Supply Chain job tweets in Kansas City, KS. Need help? Tweet us at @CareerArc!",0,263,188,"Kansas City, KS",KansasCity S-Chain
62a9fa7e0773fd56d77ef258,Wed Jun 15 13:54:06 +0000 2022,0,en,0,process management ibp helps manage and track supplychain processes and enables collaboration breaking ,"ArganoSCMO2 has been providing supply chain consultation and expertise since 2001, focusing on maximizing the value of the full SAP SCM suite of products.",1404,198,519,"Atlanta, GA",ArganoSCMO2
62a9fa7e0773fd56d77ef259,Wed Jun 15 13:54:04 +0000 2022,0,en,6, the impact artificial intelligence injection molding artificialintelligence technology machinelearning deeplear ,"Official news and insights. Top 10 influencer #gdpr, #privacy, #ai, #dataprotection, #ml, #cybersecurity, #ibm,  #dataprivacy, #ccpa, #infosec, #security, #data",78621,7267,1,"England, United Kingdom",Data Governance Framework
62a9fa7e0773fd56d77ef25a,Wed Jun 15 13:54:01 +0000 2022,0,en,6, curb china grip antimony therefore the house armed services committee released draft legislation june ,"Day/Swing trader and investor, posts are MY ideas/watchlist📈💰",8541,754,143,,TaterChip
62a9fa7e0773fd56d77ef25b,Wed Jun 15 13:53:27 +0000 2022,5,en,6,the impact artificial intelligence injection molding artificialintelligence technology machinelearning ,"https://t.co/ZqxC0kYMSK - Provides 360-degree coverage of the latest #News in #Education, #Science, #Technology, #Health, #Business, #Cryptocurrency, and more.",1501,1528,1912,"New Delhi, India",Direct News 99
62a9fa7e0773fd56d77ef25c,Wed Jun 15 13:52:27 +0000 2022,0,en,3, our procurement and supplychain solutions yash gives breakdown some the most insightful topics seen ,Procurement Leaders™ is the world’s largest and most valued procurement network and intelligence platform.,858,21128,901,London,Procurement Leaders
62a9fa7e0773fd56d77ef25d,Wed Jun 15 13:52:20 +0000 2022,0,en,6, curb china grip antimony therefore the house armed services committee released draft legislation june ,Full time front loader. Not investment advice. Here for the multi baggers and good vibes!💰💰💰,11258,768,232,,Wild_Horizon_Tradez
62a9fa7e0773fd56d77ef25e,Wed Jun 15 13:52:19 +0000 2022,0,en,0, have supplychain jobs open today troymi check them out via the link our bio ,"Follow this account for geo-targeted Supply Chain job tweets in Troy, MI. Need help? Tweet us at @CareerArc!",0,265,189,"Troy, MI",TroyMI S-Chain
62a9fa7e0773fd56d77ef25f,Wed Jun 15 13:51:14 +0000 2022,1,lt,1, vgo vgb vaga nsav xrpledger xrp bnb layer lca lci supplychain staking ,interoperability,3036,131,296,,dNs | Quamfy Vagabond
62a9fa7e0773fd56d77ef260,Wed Jun 15 13:51:07 +0000 2022,0,en,6, curb china grip antimony therefore the house armed services committee released draft legislation june ,"I document my own #pennystock and #bigboard day/swing #trading. Tweets are not advice. I have 90yo shriveled nuts. Not an MJ expert, just a fan of the product.",28698,15245,3516,NY,Alan Weedspan
62a9fa7e0773fd56d77ef261,Wed Jun 15 13:50:28 +0000 2022,1,en,1,drone delivery year gestation for amazon prime air drones dronedelivery ,"Industry Analyst & Host of Talking Logistics, an online video talk show where I interview Thought Leaders & Newsmakers in the Supply Chain & Logistics Industry",1215,3654,593,,Adrian Gonzalez
62a9fa7e0773fd56d77ef262,Wed Jun 15 13:50:16 +0000 2022,0,en,6, curb china grip antimony therefore the house armed services committee released draft legislation june ,👊 P/T OTC trader. Posts aren't investment advice! Always do your own research! Patience and DD are 🔑 👊 #staygreen #patiencepays,67734,25738,728,,Joe Cazz
62a9fa7e0773fd56d77ef263,Wed Jun 15 13:50:07 +0000 2022,0,en,3, national virtual training pharmaceutical supplychain platform with lagos amuwo apapa king and surulere ,"B. Pharm, Clin Pharm.
Note: All medicines are potential poisons",445,70,308,,Pharm. Abiodun
