_id,created_at,favorite_count,lang,retweet_count,text,user_descreption,user_favourites_count,user_followers_count,user_friends_count,user_location,user_name
62a9fa7e0773fd56d77ef12a,Wed Jun 15 15:27:20 +0000 2022,0,en,18, from factory your doorstep with the right data can help you automate your entire supply chain around ,your favorite💕 👦 boi,37464,395,478,"Lagos, Nigeria",Olu Mayowa 🇳🇬
62a9fa7e0773fd56d77ef12b,Wed Jun 15 15:27:13 +0000 2022,0,en,1, thank you for exploring the current supplychain outlook and tips for advancement with members our ,FORGE is a 501c3 nonprofit on a mission to help innovators navigate the journey from physical prototype through to commercialization and IMPACT at scale.,3193,704,923,,FORGE
62a9fa7e0773fd56d77ef12c,Wed Jun 15 15:25:39 +0000 2022,0,en,0,have you ever had role like customs amp trade compliance mgr remote what did you like most about that job supplychain thedford ,Follow this account for geo-targeted Supply Chain job tweets in Nebraska Non-Metro. Need help? Tweet us at @CareerArc!,0,236,191,Nebraska,NE SupplyChn
62a9fa7e0773fd56d77ef12d,Wed Jun 15 15:25:00 +0000 2022,0,und,0, solution solutions supplychain hydraulic hydraulics heavyduty mechanic hydraulicrepair quality value ,"A leader in cylinder sealing technology. We engineer,design,manufacture, and stock seals and packing for commercial, industrial and military applications!",198,358,808,"Manchester, PA USA",AYTweets
62a9fa7e0773fd56d77ef12e,Wed Jun 15 15:22:45 +0000 2022,0,en,1, 𝐶𝐸𝑂𝑓𝑜𝑟𝐿𝐼𝐹𝐸 𝑵𝒐𝒎𝒊𝒏𝒂𝒕𝒊𝒐𝒏 𝑁𝑒𝑤𝑠 stay date sustainability visiting ,Global policy and action lab of @weincludedorg for supporting & cultivating next-gen leaders to solve world challenges @forglobalgoals by co-creation!,26,6651,3,"Palo Alto, CA",SDGs Co:Lab
62a9fa7e0773fd56d77ef12f,Wed Jun 15 15:22:42 +0000 2022,0,en,8, for those doing business with china starting next tuesday goods sourced mined produced manufactured who ,"Legal Analyst @BLaw. Law school innovation & legal tech enthusiast. @UTAustin (hook 'em!) & @VanderbiltLaw grad. Dog mom🐶. 
Tweets are mine; RTs≠endorsements.",1034,262,455,"Washington, DC",Rachael Pikulski
62a9fa7e0773fd56d77ef130,Wed Jun 15 15:22:31 +0000 2022,0,en,0, for vivatech ownest has talks one them tomorrow the booth great ,"Ownest leverages #NFT technology and open #blockchain to create a unique SaaS tracking software for #Supplychain.

Since 2017",1884,940,181,"Paris, France",Ownest
62a9fa7e0773fd56d77ef131,Wed Jun 15 15:22:23 +0000 2022,0,en,17, some the biggest stores are reportedly seeing shortage feminine hygiene products while the cost the essentia ,We are an electric car company.,36496,1801,1966,Michigan,Mote Motor Company
62a9fa7e0773fd56d77ef132,Wed Jun 15 15:22:02 +0000 2022,0,en,1,𝐶𝐸𝑂𝑓𝑜𝑟𝐿𝐼𝐹𝐸 𝑵𝒐𝒎𝒊𝒏𝒂𝒕𝒊𝒐𝒏 𝑁𝑒𝑤𝑠 stay date sustainability visiting ,The CEOforLife Awards honour CEOs that have set new standards of excellence in their SDGs projects to achieve a better and more Sustainable Future.,24,14,34,"Rome, Italy",Global CEOforLIFE Awards
62a9fa7e0773fd56d77ef133,Wed Jun 15 15:20:08 +0000 2022,0,bn,2, সরব করছ ,"I am a college student
I am a cricket fan",175947,117,374,Khardaha,Avirup Sen
62a9fa7e0773fd56d77ef134,Wed Jun 15 15:20:06 +0000 2022,1,en,1,thank you for exploring the current supplychain outlook and tips for advancement with members ,The largest #climatetech startup incubator in North America—powered by a community of #entrepreneurs tackling the biggest #climate + #environmental challenges.,13305,14809,2612,"Somerville, MA + Houston, TX",Greentown Labs
62a9fa7e0773fd56d77ef135,Wed Jun 15 15:19:36 +0000 2022,0,en,0,why mins delivery necessary all views are welcome minsdelivery supplychain ratrace,ॐ तत् सत्,192,1,187,,Prateek
62a9fa7e0773fd56d77ef136,Wed Jun 15 15:19:00 +0000 2022,0,und,0, solution solutions supplychain hydraulic hydraulics heavyduty mechanic hydraulicrepair quality value ,"A leader in cylinder sealing technology. We engineer,design,manufacture, and stock seals and packing for commercial, industrial and military applications!",198,358,808,"Manchester, PA USA",AYTweets
62a9fa7e0773fd56d77ef137,Wed Jun 15 15:18:50 +0000 2022,0,en,0,the value the service offer goes beyond inventory management and beyond supply chain visibility are hirin ,Yusen Logistics is an award-winning #global #logistics provider with more than 60 years of expertise in #freight forwarding and #transportation.,0,65,110,,Yusen Logistics Careers
62a9fa7e0773fd56d77ef138,Wed Jun 15 15:18:39 +0000 2022,0,en,0,check out our latest supplychain openings worldwide clicking the link our bio ,Follow this account for geo-targeted Supply Chain job tweets in Worldwide. Need help? Tweet us at @CareerArc!,0,270,204,Worldwide,Worldwide SupplyChn
62a9fa7e0773fd56d77ef139,Wed Jun 15 15:18:33 +0000 2022,0,en,0, our new range business intelligence products display multimodal helping companies make more effective use ,"🚀 Do data stuff. Do software integration and engagement stuff. 🚴‍♂️ Ride bikes, love bikes 🚴‍♂️ Customer Success & Sales guy @ theifactory.",2199,995,1882,United Kingdom,📲 Dazza Blackstock 🇪🇺
62a9fa7e0773fd56d77ef13a,Wed Jun 15 15:18:00 +0000 2022,0,en,0, world where everything moving digital here quick overview how ecu helps freight forwarders ,"The world's go-to digital platform for global trade.
#freightforwarder #logistics #supplychain #digitallogistic",4,38,2,,ECU360
62a9fa7e0773fd56d77ef13b,Wed Jun 15 15:17:40 +0000 2022,0,en,0,are you ready take the next step your career are hiring check out the full time roles are currently ,#SupplyChain #Staffing #IT #Jobs Sister Company @SpinnakerSCA | Helping our Clients fill peripheral skills “Back-up” Staffing needs.,120,86,296,"Pittsburgh, PA",Pros2Plan
62a9fa7e0773fd56d77ef13c,Wed Jun 15 15:16:56 +0000 2022,0,en,3, our deputy ceo malgosia bartosik annual conference serock poland main topics this year editio ,Baltic Offshore Wind starts in Rumia,678,267,732,"Rumia, Poland",Baltic Offshore Wind Rumia
62a9fa7e0773fd56d77ef13d,Wed Jun 15 15:16:33 +0000 2022,1,it,0, vuole tornare avere una propria industria per electricvehicles deve uscire dalle logiche delle attual ,"Ingegnere minerario. Autore di ""Energia Verde? Prepariamoci a scavare"". Nato a Venezia (già Serenissima Repubblica) vivo a Bologna (già Stato Pontificio)",1173,205,186,"Bologna, Emilia Romagna",Giovanni Brussato
62a9fa7e0773fd56d77ef13e,Wed Jun 15 15:16:06 +0000 2022,0,bn,2, সরব করছ ,Human,6833,109,397,"Bengaluru South, India",Anasua
62a9fa7e0773fd56d77ef13f,Wed Jun 15 15:15:04 +0000 2022,0,en,0,cdm software solutions awarded top logistics provider logistics transport ,"CDM Asset, Inspection, Maintenance (AIM) is a complete mobile & web solution that utilizes RFID, GPS to assist Oil & Gas service providers & Other Industries",0,7,62,"Dallas, Texas",CDM AIM
62a9fa7e0773fd56d77ef140,Wed Jun 15 15:15:04 +0000 2022,0,en,0,cdm software solutions awarded top logistics provider logistics transport ,Global Logistics & Supply Chain Technology Software Solutions,0,6,0,"Dallas, Texas",CDM Supply Chain Technology
62a9fa7e0773fd56d77ef141,Wed Jun 15 15:15:04 +0000 2022,0,en,0,cdm software solutions awarded top logistics provider logistics transport ,"Global Logistics, Forwarding, Compliance Software Provider",0,1,0,"Global Offices, Dallas HQ","CDM Software Solutions, Inc."
62a9fa7e0773fd56d77ef142,Wed Jun 15 15:15:04 +0000 2022,0,en,0,cdm software solutions awarded top logistics provider logistics transport ,"Supply Chain, Logistics, Shipment Visibility, Compliance, Asset Tracking via GPS,IOT,RFID and CERTIFIED U.S. Customs software provider to Global Trade",1217,117,172,"Dallas, Texas",Darrell Ortiz - CDM
62a9fa7e0773fd56d77ef143,Wed Jun 15 15:15:00 +0000 2022,0,en,0,retailers grapple with commerce drag profits report supplychain retail ecommerce,"Tweeting, Blogging, and Podcasting about 
Trends & Innovations in Supply Chain and Logistics

DM for Sponsored Content options",1532,22689,7858,"Rotterdam, the Netherlands",Martijn Graat
62a9fa7e0773fd56d77ef144,Wed Jun 15 15:14:44 +0000 2022,0,en,4, mercé presents creating value patientcentred care aligning the supplychain service ,"Vanprob Solutions works into field of Research, Manufacturing, Marketing & Commerce; with allies in India, USA, UK, Korea, Sweden, Australia, Japan, etc.",0,83,1,"Mumbai, India",Vanprob
62a9fa7e0773fd56d77ef145,Wed Jun 15 15:14:39 +0000 2022,0,en,6, the impact artificial intelligence injection molding artificialintelligence technology machinelearning deeplear ,"Vanprob Solutions works into field of Research, Manufacturing, Marketing & Commerce; with allies in India, USA, UK, Korea, Sweden, Australia, Japan, etc.",0,83,1,"Mumbai, India",Vanprob
62a9fa7e0773fd56d77ef146,Wed Jun 15 15:14:33 +0000 2022,0,en,1, the north carolina collaboratory relies sas for iot azure harness the complex system cold chain logistics learn ,"Entrepreneur. #IoT, #Robotics, #HPC, #IoTSecurity, #IIoT, #DeepLearning",419,3916,102,,IoT Together
62a9fa7e0773fd56d77ef147,Wed Jun 15 15:14:30 +0000 2022,0,en,3, thanks craig hillier paul and sean harapko from for joining the ceoleadershipcouncil for enlightening disc ,"Vanprob Solutions works into field of Research, Manufacturing, Marketing & Commerce; with allies in India, USA, UK, Korea, Sweden, Australia, Japan, etc.",0,83,1,"Mumbai, India",Vanprob
62a9fa7e0773fd56d77ef148,Wed Jun 15 15:14:06 +0000 2022,1,fr,0, vivatech dira jamais assez toute importance traçabilité alimentaire est que propose ,"Agence Conseil & Formation 
#Communication #Digital #SocialMedia 
#RSE #FeelGood
#Speaker 
Mode▶️&⏸️ 
@LaBrigadeDuWeb 
Pdte @FeminismeAsso 
#ExpertesDuNumérique",54004,12784,5189,"Ile-de-France, France",Martine Le Jossec à #Vivatech & #FeelGood 🙏🏼
62a9fa7e0773fd56d77ef149,Wed Jun 15 15:14:00 +0000 2022,0,en,1,the north carolina collaboratory relies sas for iot azure harness the complex system cold chain logist ,"Senior Industry Consultant 
@SASMfg | #analytics | #IoT | #supplychain |  #quality | #reliability Family man, Hokies fan. Tweets are mine.",152,118,67,,Bryan Saunders
62a9fa7e0773fd56d77ef14a,Wed Jun 15 15:13:58 +0000 2022,0,en,0,matchmarketplace our collaborative neutral platform where supplychain stakeholders connect uncover street ,MatchBack Systems provides the leading software solution for container street-turns to reduce cost and emissions by eliminating empty inland moves.,306,74,167,North America,MatchBack Systems
62a9fa7e0773fd56d77ef14b,Wed Jun 15 15:12:37 +0000 2022,1,de,0,taiwan investiert viel weiter epizentrum der chipfertigung bleiben angesichts der halbleiterkrise der geo ,Jurist am Tag und Nerd bei Nacht | taucht in der #Jurabubble | #ITSicherheit #Digitalisierung #TeamDatenschutz #TeamRechtsstaat,29025,1708,476,,Steve Ritter
62a9fa7e0773fd56d77ef14c,Wed Jun 15 15:12:09 +0000 2022,0,en,0, curious mind never rests pushes harder and searches out the right answer are you someone that relentlessly ,"Follow this account for geo-targeted Supply Chain job tweets in Ann Arbor, MI. Need help? Tweet us at @CareerArc!",0,260,189,"Ann Arbor, MI",Minnesota S-Chain
62a9fa7e0773fd56d77ef14d,Wed Jun 15 15:11:41 +0000 2022,0,en,0,looking for crystal ball predict future demand too but until find one will following these tip ,John Galt Solutions serves mid-market and large global enterprises facing complex supply chain planning challenges helping them make better and faster decisions,131,298,345,"Dallas, Texas",John Galt Solutions
62a9fa7e0773fd56d77ef14e,Wed Jun 15 15:11:35 +0000 2022,0,en,0, tried and true ways improve your supply chain supplychain sourcing globalsupplychain ,"Engineered Space Optimization

SpanTrack | FlowCell | SpeedCell

Smart Space Solutions that Transform the Supply Chain.",4103,2131,1968,"Lakewood, NJ",UNEX Manufacturing
62a9fa7e0773fd56d77ef14f,Wed Jun 15 15:11:29 +0000 2022,0,en,0,want land job like warehouse loader shift cvs health applicant tracking systems look for specific ,"Follow this account for geo-targeted Supply Chain job tweets in Fairfax, VA. Need help? Tweet us at @CareerArc!",0,286,185,"Fairfax, VA",Fairfax Area S-Chain
62a9fa7e0773fd56d77ef150,Wed Jun 15 15:11:20 +0000 2022,0,en,0, supplychain conscious labor relations managers take note colleague looks ahead the impa ,"Legal Analyst for @BloombergLaw covering labor & employment. Former librarian, carnival barker, game show champion. Tweets are my own. RTs are not endorsements.",1046,366,319,"Washington, DC",Robert Combs
62a9fa7e0773fd56d77ef151,Wed Jun 15 15:11:19 +0000 2022,0,en,0, never heard many challenges supplychain ,The Newspaper of Trucking and Freight Transportation,1010,44011,3318,,Transport Topics
62a9fa7e0773fd56d77ef152,Wed Jun 15 15:11:12 +0000 2022,0,en,1, drone delivery year gestation for amazon prime air drones dronedelivery ,"Citizen 🌍 podcaster🎙& blogger #WordsMatter. Runner, ⛳️ + writing a 📖. RT 🚫 endorsements, ops my own #ClimateAction 🌱 #Pride + Viva 🇺🇦",13557,2862,2863,England,Jimmy Canham-Ash
62a9fa7e0773fd56d77ef153,Wed Jun 15 15:11:01 +0000 2022,0,en,1, you can sustainable without your suppliers things learned about supplier sustainability from industry ,"Citizen 🌍 podcaster🎙& blogger #WordsMatter. Runner, ⛳️ + writing a 📖. RT 🚫 endorsements, ops my own #ClimateAction 🌱 #Pride + Viva 🇺🇦",13557,2862,2863,England,Jimmy Canham-Ash
62a9fa7e0773fd56d77ef154,Wed Jun 15 15:10:59 +0000 2022,0,en,0,got drought learn how businesses can use risk management insights identify forecast and mitigate this summe ,Everstream is a supply chain risk analytics company that delivers actionable insights to increase the resilience and agility of our clients’ supply chains.,234,385,87,"San Marcos, California, US",Everstream Analytics
62a9fa7e0773fd56d77ef155,Wed Jun 15 15:10:48 +0000 2022,0,en,0,are you doing these time saving tips improve your warehouse efficiency supplychain warehousemanagement ,Since 1968 we've been helping clients improve operations and financial performance throughout the entire supply chain.,44,209,162,"Tampa, FL",USC Consulting Group
62a9fa7e0773fd56d77ef156,Wed Jun 15 15:10:46 +0000 2022,2,fr,0, vivatech envie savoir plus sur avenir logistique innovation dans supplychain vous conse ,"Agence Conseil & Formation 
#Communication #Digital #SocialMedia 
#RSE #FeelGood
#Speaker 
Mode▶️&⏸️ 
@LaBrigadeDuWeb 
Pdte @FeminismeAsso 
#ExpertesDuNumérique",54004,12784,5189,"Ile-de-France, France",Martine Le Jossec à #Vivatech & #FeelGood 🙏🏼
62a9fa7e0773fd56d77ef157,Wed Jun 15 15:10:41 +0000 2022,0,en,1, when faced the supplychain issues currently plaguing global markets where did they turn they mobilized advanced ,"Citizen 🌍 podcaster🎙& blogger #WordsMatter. Runner, ⛳️ + writing a 📖. RT 🚫 endorsements, ops my own #ClimateAction 🌱 #Pride + Viva 🇺🇦",13557,2862,2863,England,Jimmy Canham-Ash
62a9fa7e0773fd56d77ef158,Wed Jun 15 15:10:30 +0000 2022,0,en,0, you looking for work fortwayne check out this job supplychain,"Follow this account for geo-targeted Supply Chain job tweets in Indianapolis, IN. Need help? Tweet us at @CareerArc!",0,260,195,"Indianapolis, IN",Indianapolis S-Chain
62a9fa7e0773fd56d77ef159,Wed Jun 15 15:10:15 +0000 2022,0,en,1, the industrial supply chain crisis solved with technology supplychain,"Citizen 🌍 podcaster🎙& blogger #WordsMatter. Runner, ⛳️ + writing a 📖. RT 🚫 endorsements, ops my own #ClimateAction 🌱 #Pride + Viva 🇺🇦",13557,2862,2863,England,Jimmy Canham-Ash
62a9fa7e0773fd56d77ef15a,Wed Jun 15 15:09:19 +0000 2022,0,en,0, you looking for work jeff check out this job supplychain,"Follow this account for geo-targeted Manufacturing job tweets in Louisville, KY. Need help? Tweet us at @CareerArc!",0,162,101,"Louisville, KY",TMJ - SDF Manuf Jobs
62a9fa7e0773fd56d77ef15b,Wed Jun 15 15:09:09 +0000 2022,0,en,0,why can supply chains keep pace with change disruption the word the year explains what ,Global hub for supply chain management thought leadership & talent development @UTKnoxville's @HaslamUT,155,1182,486,The University of Tennessee,Global Supply Chain Institute (GSCI)
62a9fa7e0773fd56d77ef15c,Wed Jun 15 15:09:07 +0000 2022,0,en,0,last chance register for the june economics cargo webinar live tomorrow with clivedataservices ,"The International Air Cargo Association (TIACA) represents, supports, informs, and connects every element of the global air freight supply chain.",9187,3839,886,"Miami, FL",TIACA
62a9fa7e0773fd56d77ef15d,Wed Jun 15 15:08:16 +0000 2022,0,en,2, mercé presents creating value patientcentred care aligning the supplychain service ,"Innovation & Value Based Procurement practitioner, passionate in healthcare digital tranformation, art, history and my home country. RT is information sharing",2565,244,1036,,Rossana
62a9fa7e0773fd56d77ef15e,Wed Jun 15 15:08:09 +0000 2022,0,en,4, mercé presents creating value patientcentred care aligning the supplychain service ,"Innovation & Value Based Procurement practitioner, passionate in healthcare digital tranformation, art, history and my home country. RT is information sharing",2565,244,1036,,Rossana
62a9fa7e0773fd56d77ef15f,Wed Jun 15 15:08:00 +0000 2022,0,en,0,earning diploma supply chain and logistics management helps open your opportunities based fields related ,CCHS is managed and guided by consultants with more than 32 years experience in emerging technologies & over 30 years experience in providing education.,17,130,126,"Toronto, ON 416-850-1456",CCHS
62a9fa7e0773fd56d77ef160,Wed Jun 15 15:06:48 +0000 2022,0,en,0,don shy score job like material handler forklift operator plastipak asking for referrals ,Follow this account for geo-targeted Supply Chain job tweets in Iowa Non-Metro. Need help? Tweet us at @CareerArc!,0,245,195,Indiana,Iowa S-Chain
62a9fa7e0773fd56d77ef161,Wed Jun 15 15:06:38 +0000 2022,1,en,0, was pleasure speaking with miroslav babol and engaging with the attendees the zero forum ,"CEO @Blume_Global, constantly in search of new learnings in technology, business and life",129,216,100,"Pleasanton, CA",Pervinder Johar
62a9fa7e0773fd56d77ef162,Wed Jun 15 15:06:37 +0000 2022,0,en,0,registration open trade with africa business summit tradewithafrica africa export ,Executive Coach & Business Strategist 🌍 Founder Nazaru 🍁 Policy Advocate 🏭 Economic Dev. Adviser 👥 Summit Convener | see more at 🔗 http://www.ToyinUmesiri.,1094,1558,4729,"Chicago, IL",Toyin Umesiri
62a9fa7e0773fd56d77ef163,Wed Jun 15 15:05:49 +0000 2022,0,en,0,want work cvs health hiring spokane click the link our bio for details this job and mor ,"Follow this account for geo-targeted Supply Chain job tweets in Spokane, WA. Need help? Tweet us at @CareerArc!",0,222,189,"Spokane, WA",Spokane S-Chain
62a9fa7e0773fd56d77ef164,Wed Jun 15 15:05:22 +0000 2022,0,en,4, mercé presents creating value patientcentred care aligning the supplychain service ,"EHMA is a membership organisation committed to excellence in #healthmanagement across Europe

#EHMA2022 Annual Conference | 15-17 June | Brussels, Belgium",3991,4556,2382,Brussels,European Health Management Association
62a9fa7e0773fd56d77ef165,Wed Jun 15 15:05:02 +0000 2022,0,en,0,for agility and flexibility today complex supply chain environments you need diverse collaborative professio ,We provide global solutions for Cold Chain Packaging | Monitoring | Logistics,3635,241,816,Kingdom of Saudi Arabia,Cold Chain Packing & Logistics
62a9fa7e0773fd56d77ef166,Wed Jun 15 15:04:47 +0000 2022,3,en,4, mercé presents creating value patientcentred care aligning the supplychain ,"RITMOCORE is a Public Procurement of Innovation (PPI) project, funded by the European Union under Horizon2020.",40,97,72,,RITMOCORE PPI
62a9fa7e0773fd56d77ef167,Wed Jun 15 15:04:23 +0000 2022,0,und,0, importer customsclearance obc onboardcourier importer record transportation ior services ,"AGOL Worldwide is an International Logistics Company specializing in urgent logistics for aviation parts, telecom equipment, networking, broadcasting equipment.",18,17,212,"Doral, FL",AGOL Worldwide
62a9fa7e0773fd56d77ef168,Wed Jun 15 15:03:19 +0000 2022,0,en,47, guessing this altcoin season perfect time get board with blockchain ,"Just a Gaymer turned Cryptonian turned NFTer!! Co-founder 
@Crumplies ;-*",9443,605,4223,"Los Wages, Nv",420fairieT.Crypto{.wyaw.wam}🔥B
62a9fa7e0773fd56d77ef169,Wed Jun 15 15:03:08 +0000 2022,0,en,0, streamline microsoftdynamics for finance and supplychain and crm deployments sikich has developed the ,"Realize your long-term strategic business goals through our #accounting, #technology, advisory and managed services.",314,3025,1827,Nationwide,Sikich LLP
62a9fa7e0773fd56d77ef16a,Wed Jun 15 15:03:03 +0000 2022,0,en,0,how supplychain turmoil remaking the automotive industry via ,Morai Logistics Inc. is a 3rd party logistics provider representing Mode Transportation.  We are a powerhouse logistics team based in the Greater Toronto Area.,2330,4527,3046,,Morai Logistics Inc
62a9fa7e0773fd56d77ef16b,Wed Jun 15 15:02:17 +0000 2022,0,en,0,fresenius medical care hiring coppell read about our latest supplychain job opening via the link our bio driver cdl,"Follow this account for geo-targeted Supply Chain job tweets in DFW, Texas. Need help? Tweet us at @CareerArc!",0,268,197,"DFW, Texas",Dallas S-Chain
62a9fa7e0773fd56d77ef16c,Wed Jun 15 15:02:10 +0000 2022,0,en,0,get certificate logistics and supply chain management supplychain logistics transportation ,Africa's foremost supply chain platform for professionals,0,9,6,Africa,African Centre For Supply Chain
62a9fa7e0773fd56d77ef16d,Wed Jun 15 15:02:04 +0000 2022,1,en,0, eager learn about advancements oil amp gas sector explore top digitaloilfield solutions facilitating ,"Head of Communications @StartUsInsights 🚀  

Helping you access the world's information on innovation, technologies & emerging companies",2903,52448,38451,Global,Susi Wallner
62a9fa7e0773fd56d77ef16e,Wed Jun 15 15:01:37 +0000 2022,0,en,0,looking score job ingram content group you luck click the link our bio for the job description ,Follow this account for geo-targeted Supply Chain job tweets in Tennessee Non-Metro. Need help? Tweet us at @CareerArc!,0,235,194,Tennessee,Tennessee S-Chain
62a9fa7e0773fd56d77ef16f,Wed Jun 15 15:01:28 +0000 2022,0,en,0,new freight route announced between rosslaire ireland and zebrugge belgium just the latest route between ireland ,"Looking for a writing/broadcasting job when I return to UK in August. BA,MA, 3 gold NCTJs. Specialisms- supply chain, sports. DM me boss folk!

Keen #ncfc fan.",47029,1557,3598,🌍27 countries & counting 🌏,Sam Victor Jermy 🇺🇦
62a9fa7e0773fd56d77ef170,Wed Jun 15 15:01:24 +0000 2022,0,en,0, study suggests that coldchain foods may spread the covid virus over long distances amp discusses testing method ,"Multimedia resource for science-based solutions for food safety & quality assurance professionals worldwide. eMagazine, online, and podcast!",867,24671,996,,Food Safety Magazine
62a9fa7e0773fd56d77ef171,Wed Jun 15 15:01:22 +0000 2022,0,en,0, syft our customers are key and our products are always evolving meet their needs read our latest blog high ,Chief Executive Officer of @syftcorp. Reimagine your Healthcare Supply Chain.,63,70,174,"Tampa, FL",Todd Plesko
62a9fa7e0773fd56d77ef172,Wed Jun 15 15:01:14 +0000 2022,0,en,0,how supplychain leaders can prepare for the next big disruption via ,"Content Thought Leader at @Enablon, a @Wolters_Kluwer Business. #EHS #RiskManagement #Sustainability",30,165,154,"Montréal, Québec, Canada",Jean-Grégoire Manoukian
62a9fa7e0773fd56d77ef173,Wed Jun 15 15:00:50 +0000 2022,0,en,0,join lora cecere and and madhav durbha ,The Voice of Supply Chain,7799,20313,12514,,Supply Chain Now
62a9fa7e0773fd56d77ef174,Wed Jun 15 15:00:26 +0000 2022,2,en,1,when faced the supplychain issues currently plaguing global markets where did they turn they mobilized ,"This is the official account of DHL Global Trade; delivering you global trade news, reports and insights from across the world.",1914,102902,581,"Bonn, Germany",DHL Global Trade
62a9fa7e0773fd56d77ef175,Wed Jun 15 15:00:25 +0000 2022,0,en,0,the price diesel record high what that means for supply chain professionals today and how get the ,We work around the clock in over 130 countries worldwide towards one goal: making your logistics even more efficient.,3439,3141,875,"Chesapeake, VA",DB Schenker USA
62a9fa7e0773fd56d77ef176,Wed Jun 15 15:00:24 +0000 2022,0,en,0,amazon sued for removing free whole foods delivery from prime supplychain ecommerce,"Tweeting, Blogging, and Podcasting about 
Trends & Innovations in Supply Chain and Logistics

DM for Sponsored Content options",1532,22689,7858,"Rotterdam, the Netherlands",Martijn Graat
62a9fa7e0773fd56d77ef177,Wed Jun 15 15:00:23 +0000 2022,0,en,0,influencers secret weapon for tackling supplychain challenges retail touchpoints ,"We affect change.

#BeSwayd

B2B Influencer Marketing",3415,4501,2676,"California, USA",Swayd Company
62a9fa7e0773fd56d77ef178,Wed Jun 15 15:00:18 +0000 2022,0,en,0, gep geoffroy naegelen had engaging dialogue sustainability supplychain with johnson amp johnson cpo ,"Global leader in unified supply chain solutions that help enterprises operate more efficiently, gain competitive edge, boost profitability and maximize value.",227,15186,656,"Clark, NJ",GEP ®
62a9fa7e0773fd56d77ef179,Wed Jun 15 15:00:13 +0000 2022,0,de,0, cloudcomputing für smarte logistik prozesse die cloud verlagern bietet transport und logistics unterne ,Interxion: A Digital Realty Company ist ein führender Anbieter von Carrier- und Cloud-neutralen Rechenzentrumsdienstleistungen für Colocation in ganz EMEA.,1999,2930,4829,"Frankfurt am Main, Deutschland",Interxion Deutschland GmbH
