_id,created_at,favorite_count,lang,retweet_count,text,user_descreption,user_favourites_count,user_followers_count,user_friends_count,user_location,user_name
62a9fa7e0773fd56d77ef264,Wed Jun 15 13:48:41 +0000 2022,0,en,0,with staffing shortages supplychain challenges amp evolving consumer behaviors profit margins are tighter than ,An end-to-end AP and Payment Automation solution that integrates with 1000s of accounting systems.,312,1217,1305,"Boston, MA",MineralTree
62a9fa7e0773fd56d77ef265,Wed Jun 15 13:48:08 +0000 2022,0,en,3, thanks craig hillier paul and sean harapko from for joining the ceoleadershipcouncil for enlightening disc ,Comms Director for @GlobalBiz - promoting  & defending an open economy that welcomes companies to invest in the US | @DietCoke addict. | Tweets are my own.,3161,519,1067,"Washington, DC",Jessica Cahill
62a9fa7e0773fd56d77ef266,Wed Jun 15 13:48:06 +0000 2022,0,en,0, inflation peaking factors need solved asap avoid stagflation russiaukrainewar amp fix ,Investidea your go to place for investment ideas (IDEAS are NOT investment advice),4343,482,2891,"Hedge End, England",Investidea
62a9fa7e0773fd56d77ef267,Wed Jun 15 13:47:54 +0000 2022,0,en,6, observations from kubeconeu peak maturity big push for platforms top everyone talking supp ,"Compose cloud infrastructure and services into custom platform APIs.  A @CloudNativeFdn project, created by @upbound_io. Join the community https://t.co/KIx9GC52Uv",1264,5215,42,,crossplane
62a9fa7e0773fd56d77ef268,Wed Jun 15 13:47:17 +0000 2022,0,en,1, our coo quoted find out what she has say about the indian government policies ,Founder @Market_Orders | Worlds 1st #Blockchain #Author | FT100DigitalPioneer |#Tech100Women | #Speaker| #Entrepreneur | #womeninblockchain #womenintech |,3415,1548,3739,"London, England",Sukhi Jutla
62a9fa7e0773fd56d77ef269,Wed Jun 15 13:47:12 +0000 2022,0,en,2, our coo guest the business without bullshit podcast she shared her journey female entrepreneur amp ,Founder @Market_Orders | Worlds 1st #Blockchain #Author | FT100DigitalPioneer |#Tech100Women | #Speaker| #Entrepreneur | #womeninblockchain #womenintech |,3415,1548,3739,"London, England",Sukhi Jutla
62a9fa7e0773fd56d77ef26a,Wed Jun 15 13:46:57 +0000 2022,0,en,0, the transition greenenergy communities the source the supplychain face double burden adverse effe ,"Standing with those harmed to hold companies to account for human rights abuses, environmental harm and corruption. #bizhumanrights",6464,4122,2378,"London, England",RAID
62a9fa7e0773fd56d77ef26b,Wed Jun 15 13:46:42 +0000 2022,1,en,0, the final countdown opticon here supplychain conference ,"Introducing the next generation web-based optimization studio that enables you to build high-fidelity models from anywhere, ready to be deployed.",29,16,51,"Ann Arbor, MI",Optilogic
62a9fa7e0773fd56d77ef26c,Wed Jun 15 13:46:36 +0000 2022,0,en,1, richmint dao can provide secure way recording information about responsible parties and their actions suppl ,,3605,37,52,,estemax
62a9fa7e0773fd56d77ef26d,Wed Jun 15 13:46:02 +0000 2022,0,en,0,got fastener industry news share with link magazine and will get the word out for you easy submit ,The National Magazine for Fastener Distributors. We're The Nuts & Bolts of Your Advertising Program! #ThinkLINK #fasteners #mfg #distribution #fastenernews,6055,2461,1564,"Naples, FL",Link Magazine
62a9fa7e0773fd56d77ef26e,Wed Jun 15 13:45:09 +0000 2022,0,de,0,auf dem automobilgipfel auto summit hatte bundeskanzlerin angela merkel den datenraum zur top priorität der ,#digital #marketing #businessdevelopment #europäer,3107,106,246,"Bonn, Deutschland",tompeschke
62a9fa7e0773fd56d77ef26f,Wed Jun 15 13:45:08 +0000 2022,0,en,3, national virtual training pharmaceutical supplychain platform with lagos amuwo apapa king and surulere ,The Podcasting Leader in #Pharmacy. We’re the #UberPodcasting Platform for @Pharmacists. #TogetheRx #twitteRx & #USPhArmy | #Pharmacists # 1 FAN 🎙 EST. 2009,24983,27319,8073,United States,Pharmacy Podcast Network
62a9fa7e0773fd56d77ef270,Wed Jun 15 13:44:56 +0000 2022,0,en,0,new job account manager location castleford salary kpa kpa jobs supplychain logistics,"For our official Twitter follow @Cast_UK Find the latest roles in Business Change & Transformation, HR, Procurement, Buying, Supply Chain and Logistics here.",155,374,937,"Manchester, Birmingham, London",Cast UK Jobs
62a9fa7e0773fd56d77ef271,Wed Jun 15 13:44:49 +0000 2022,0,en,0,aix sunexpress selects safran economy seat aircargo airfreight supplychain ,"Latest Shipping & Freight News, Information + Videos from around the world. #Shipping #Freight #Logistics #Trucking #SupplyChain #AirCargo #Maritime #SeaFreight",4,142,547,,Shipping & Freight Updates
62a9fa7e0773fd56d77ef272,Wed Jun 15 13:44:36 +0000 2022,0,en,6, observations from kubeconeu peak maturity big push for platforms top everyone talking supp ,News and podcasts for developers,5887,30557,1024,Houston + Omaha,Changelog
62a9fa7e0773fd56d77ef273,Wed Jun 15 13:43:59 +0000 2022,0,en,0,are you date there are key elements minimize risks from supplychain attacks and experience only num ,HolistiCyber was founded with a mission to assist organizations in defending themselves in a new phase of evolution in cyber threats. #DefendWhatMatters,617,451,301,"New York, USA",HolistiCyber Inc. #DefendWhatMatters
62a9fa7e0773fd56d77ef274,Wed Jun 15 13:43:41 +0000 2022,7,en,3,thanks craig hillier paul and sean harapko from for joining the ceoleadershipcouncil for enlighte ,"As the premier voice of international companies in the United States, we promote and defend an open economy that welcomes companies to invest in America.",904,1822,967,"Washington, DC",Global Business Alliance
62a9fa7e0773fd56d77ef275,Wed Jun 15 13:43:31 +0000 2022,0,en,6, curb china grip antimony therefore the house armed services committee released draft legislation june ,CEO - @RedBerylMining #RBMC. OEF Army Veteran. Family Man. Mentor. Private Investor. 14 Year #OTC Stock Investor. #Startup Rebuilder. Sunnyland Evolved. ⛏,39131,19853,506,Mining throughout the US,☀️Alex Sunderland☀️
62a9fa7e0773fd56d77ef276,Wed Jun 15 13:42:45 +0000 2022,8,en,6, curb china grip antimony therefore the house armed services committee released draft legislation ,Official Account of Xtra Energy Corp. OTCMarkets: $XTPT. Exploring #UnitedStates #Antimony Deposits.,1,26,9,"Austin, Texas",Xtra Energy Corp.
62a9fa7e0773fd56d77ef277,Wed Jun 15 13:42:17 +0000 2022,0,en,0,rndc looking for teammates like you see our latest supplychain job openings including customer service rep ,Follow this account for geo-targeted Supply Chain job tweets in DC Metro. Need help? Tweet us at @CareerArc!,0,255,193,"Washington, DC",WashingtonDC S-Chain
62a9fa7e0773fd56d77ef278,Wed Jun 15 13:42:08 +0000 2022,0,en,0,new job senior buyer location renfrew salary benefits jobs supplychain logistics,"For our official Twitter follow @Cast_UK Find the latest roles in Business Change & Transformation, HR, Procurement, Buying, Supply Chain and Logistics here.",155,374,937,"Manchester, Birmingham, London",Cast UK Jobs
62a9fa7e0773fd56d77ef279,Wed Jun 15 13:42:00 +0000 2022,0,en,0,severfield enjoys record order book operating margin remains stable despite inflationary supply chain pressu ,"Daily rolling news, tailored for you
Official partner of @UK_CW

Use our hashtag #constructionbuzz",2287,194,408,Loughton,Construction Buzz
62a9fa7e0773fd56d77ef27a,Wed Jun 15 13:41:58 +0000 2022,0,en,0,this visual looks the day day effects inflation the price hamburger supplychain logistics ,"*Insights* Articles* Metrics* News* Sharing Trends, Best Practices and Global Stories for Supply Chain Management Professionals and Industry Insiders on Twitter",1215,1609,1415,Canada,Supply Chain Logistics Consulting dba
62a9fa7e0773fd56d77ef27b,Wed Jun 15 13:41:24 +0000 2022,0,en,1, survey believe smart manufacturing key organisations future success digitaltransformation technology ,,0,4975,108,Rio de janeiro,Fabricio Cavalcante
62a9fa7e0773fd56d77ef27c,Wed Jun 15 13:41:18 +0000 2022,0,en,0,this job now open rndc ashland follow and turn mobile alerts hear about jobs like these ,"Follow this account for geo-targeted Supply Chain job tweets in Richmond, VA. Need help? Tweet us at @CareerArc!",0,304,202,"Richmond, VA",Richmond SupplyChain
62a9fa7e0773fd56d77ef27d,Wed Jun 15 13:41:00 +0000 2022,0,en,0, speaker announcement delighted have debbie wall head responsible business group speak pss ,"The UK's leading event bringing together #publicsector & suppliers to deliver smarter, better & more efficient public services, July 2022 #PSS22",2764,3418,3483,"London, England",Public Sector Show
62a9fa7e0773fd56d77ef27e,Wed Jun 15 13:40:53 +0000 2022,15,en,8,for those doing business with china starting next tuesday goods sourced mined produced manufactu ,Bloomberg Law @BLaw Team Lead for Transactions: Creating innovative and analytical content and tools for corporate transactional lawyers. RTs≠endorsements.,4132,526,1000,,Diane Holt
62a9fa7e0773fd56d77ef27f,Wed Jun 15 13:40:18 +0000 2022,0,en,1, the economy dependent manufacturing and exporting and amp advocating for the development opportunities ,Canadian Manufacturers & Exporters is Canada's largest trade and industry association.,1140,7029,2105,"ÜT: 45.1147114,-75.6656944",CME-MEC
62a9fa7e0773fd56d77ef280,Wed Jun 15 13:40:11 +0000 2022,0,en,1,workers strikes threaten worsen supply chain bottlenecks holosail holosailtech ,Bridge the tech gap between the US and the rest of the global maritime industry using Holo Sail Technology® - incorporating practical software solutions,346,1190,37,United States,Holo Sail Tech INC
62a9fa7e0773fd56d77ef281,Wed Jun 15 13:40:06 +0000 2022,0,en,1, survey believe smart manufacturing key organisations future success digitaltransformation ,,26,1,182,,Ranger4Aaron
62a9fa7e0773fd56d77ef282,Wed Jun 15 13:39:24 +0000 2022,0,en,0, been posting tips for bidding supplychain contracts but should you bidding the first place here ,Connecting #womenowned businesses to #supplychain buyers | Creating small business #actionplans in @NotionHQ | Writing my 1st 📕 | Exploring the #metaverse,1413,268,281,Toronto,Stephanie Fontaine
62a9fa7e0773fd56d77ef283,Wed Jun 15 13:39:01 +0000 2022,0,en,0, traceability enables companies identify and capture data for key supply chain metrics that help build measur ,"Systech is the global technology leader in anti-counterfeiting, product safety, consumer and brand protection.",617,818,704,Princeton,Systech
62a9fa7e0773fd56d77ef284,Wed Jun 15 13:38:59 +0000 2022,0,en,0,register now for tomorrow webinar covering fsma food defense requirements and the elements food defense ,"We enjoy long walks on the beach, sunsets, and automating your processes and improving ROI to ensure a happy workforce, happy suppliers, and happy auditors.",282,2455,448,"Westminster, CO",TraceGains
62a9fa7e0773fd56d77ef285,Wed Jun 15 13:38:27 +0000 2022,0,fr,0,arefim réalise pour france centre logistique immobilier supplychain ,"VoxLog, la voix logistique au service des décideurs. #Logistique #SupplyChain #Mobilité #Transports #Ecommerce #Digital",121,2888,523,,VoxLog
62a9fa7e0773fd56d77ef286,Wed Jun 15 13:38:27 +0000 2022,0,en,0, have supplychain jobs open today nashville check them out via the link our bio ,"Follow this account for geo-targeted Supply Chain job tweets in Nashville, TN. Need help? Tweet us at @CareerArc!",0,241,200,"Nashville, TN",Nashville S-Chain
62a9fa7e0773fd56d77ef287,Wed Jun 15 13:37:43 +0000 2022,0,en,1, too much stuff despite supply chain issues retailers around the world are stuck with excess stock usa has billio ,"writer, editor, instructional design, tech consultant. I love fun, music, movies, good food, outdoors, hockey [support Sweden], new tech... and all that is J LO",5978,632,1091,"London, UK",Chris Haverly
62a9fa7e0773fd56d77ef288,Wed Jun 15 13:37:43 +0000 2022,18,en,6, observations from kubeconeu peak maturity big push for platforms top everyone tal ,Getting your best ideas into the world to see what happens (a @Changelog pod with @GerhardLazu),111,341,0,The Changelog Community,Ship It! 🚀
62a9fa7e0773fd56d77ef289,Wed Jun 15 13:36:36 +0000 2022,0,en,3, supply chain management essential part business success and the journey from idea creation end product comp ,لا إله إلا الله وحده لا شريك له له الملك وله الحمد وهو على كل شيء قدير.,5,120,145,,Mona
62a9fa7e0773fd56d77ef28a,Wed Jun 15 13:36:08 +0000 2022,0,en,0,call rvssolutions find out how jdaconsulting can help advance your logistics supplychain ,#JDASoftware #JDAconsultant #JDAsupport #JDAsupply #Logistics #SupplyChain #JDAdemand #JDAmanagement #JDAsupplymanagement #JDAimplementation,1568,179,147,USA,RVS Solutions
62a9fa7e0773fd56d77ef28b,Wed Jun 15 13:35:35 +0000 2022,0,en,0,tia president amp ceo anne reinke recently joined live last friday talk about the devastating impact the ,The Voice of Third-Party Logistics,4656,5606,571,"Alexandria, Va",Transportation Intermediaries Association (TIA)
62a9fa7e0773fd56d77ef28c,Wed Jun 15 13:35:07 +0000 2022,0,en,1, catch moderating panel the future customs trade functions brave new digital world ,"https://t.co/HjUwPzszDy…

https://t.co/gFlyz6tdek",2949,99,1638,"Chennai, India",Pranshu Bahadur
62a9fa7e0773fd56d77ef28d,Wed Jun 15 13:35:03 +0000 2022,0,en,0,how cybersecurity readiness prevents small and medium businesses smbs from fueling supply chain attacks via ,Gotham Technology Group is in the business of providing guidance and direction to IT professionals.,497,733,341,"Montvale, NJ",Gotham Tech Group
62a9fa7e0773fd56d77ef28e,Wed Jun 15 13:35:01 +0000 2022,0,de,0,oil tanker docks libya sider port despite blockade maritime shipping supplychain maritimenetwork,,0,58,15,,Maritime Network
62a9fa7e0773fd56d77ef28f,Wed Jun 15 13:34:58 +0000 2022,0,en,0, inflation supplychain troubles and other challenges are big headaches companies need proactive addre ,Enterprise Risk Management Consultant; Helping insurance companies take smart risks to improve performance. #ERM #erminsights,217,108,51,"Florida, USA",Carol Williams
62a9fa7e0773fd56d77ef290,Wed Jun 15 13:34:54 +0000 2022,0,en,0,the north carolina collaboratory relies sas for iot azure harness the complex system cold chain logist ,,2,86,31,,Anil Rao
62a9fa7e0773fd56d77ef291,Wed Jun 15 13:34:39 +0000 2022,0,en,0, blog post   supplychain technology themes ,"The Best Job Board for IT & Data Jobs since 2003.
Follow us so you never miss the hottest job posts & industry insights!",2504,6851,1243,"Carmel, IN USA",icrunchdata
62a9fa7e0773fd56d77ef292,Wed Jun 15 13:34:35 +0000 2022,3,en,3,national virtual training pharmaceutical supplychain platform with lagos amuwo apapa king and surul ,Building reliable Logistics management solutions | Digital identity management solutions | Mobile apps | Enterprise management solutions | Web,2,12,231,"Ikeja, Lagos, Nigeria ",Netop Business Consulting Ltd.
62a9fa7e0773fd56d77ef293,Wed Jun 15 13:34:29 +0000 2022,0,en,1, consistency has been for one logistics provider see the wrong others not themselves perspective ,Supply Chain/Logistics consultant & advisor. I draw on real end-to-end SCM experience. Penn Stater. Ice coffee drinker. I agree with me. Email: tomc@ltdmgmt.com,61099,1371,740,"Lehigh Valley, PA",Tom Craig
62a9fa7e0773fd56d77ef294,Wed Jun 15 13:34:08 +0000 2022,0,en,0,can you recommend anyone for these supplychain jobs toledo click the link our bio see them ,"Follow this account for geo-targeted Supply Chain job tweets in Toledo, OH. Need help? Tweet us at @CareerArc!",0,266,202,"Toledo, OH",ToledoOH S-Chaintmj_
62a9fa7e0773fd56d77ef295,Wed Jun 15 13:34:04 +0000 2022,1,en,3,our procurement and supplychain solutions yash gives breakdown some the most insightful topics ,"We're a global provider of sector-specific #research and #analytics solutions, addressing the needs of businesses in today’s intelligence age. 

#procurement",274,720,169,,The Smart Cube
62a9fa7e0773fd56d77ef296,Wed Jun 15 13:32:16 +0000 2022,0,fr,2, les amp juin lab vivatech vous permet découvrir stratup une plate ,🚀 Accélérateur de #startups au service de la démarche d'#innovation et de #transformation des entreprises du territoire.📍 #LoireAtlantique et #Vendée,7583,2808,1040,"Nantes, France",Le Village by CA Atlantique Vendée
62a9fa7f0773fd56d77ef297,Wed Jun 15 13:31:59 +0000 2022,0,en,0,want work yusen logistics hiring longbeach click for details supplychain,Yusen Logistics is an award-winning #global #logistics provider with more than 60 years of expertise in #freight forwarding and #transportation.,0,65,110,,Yusen Logistics Careers
62a9fa7f0773fd56d77ef298,Wed Jun 15 13:30:47 +0000 2022,0,en,0,now hiring for supplychain job opportunities kokomoin click the link our bio see them ,"Follow this account for geo-targeted Supply Chain job tweets in Kokomo, IN. Need help? Tweet us at @CareerArc!",0,249,190,"Kokomo, IN",Kokomo SupChn
62a9fa7f0773fd56d77ef299,Wed Jun 15 13:30:30 +0000 2022,0,en,0,used export sea worthy shipper owned containers ready for sale containers supplychain ,Used and New Cargo Sea Container Sales Specialist Company Servicing the United States.  20' Containers / 40' Containers / 45' Containers for sale nationwide.,0,3,0,,IPL Management Containers
62a9fa7f0773fd56d77ef29a,Wed Jun 15 13:30:19 +0000 2022,1,en,1, richmint dao can provide secure way recording information about responsible parties and their actions ,"The RICHMINT DAO provides Decentralized Blockchain solutions to ESG-conscious stakeholders, offering limitless possibilities in the DEFI world.",216,19097,9,,RICHMINT DAO
62a9fa7f0773fd56d77ef29b,Wed Jun 15 13:30:06 +0000 2022,1,en,1, this ebook delve into the supply chain challenges faced the cell and gene therapy industry also dive ,"The official account for the Informa Connect Cell & Gene Therapy series, featuring the latest events, content and training",140,2233,2917,London,Cell & Gene Therapy - Informa Connect
62a9fa7f0773fd56d77ef29c,Wed Jun 15 13:30:00 +0000 2022,1,en,0,home deliveries are something most can imagine our lives without supplychain logistics,Bi-monthly business intelligence magazine for men and women shaping the future of business globally.   https://t.co/jGAOfh1Fkr…,1655,1581,1408,Global,The European Business Review
62a9fa7f0773fd56d77ef29d,Wed Jun 15 13:29:07 +0000 2022,0,en,0,nervous apply for job like operations manager warehouse supply chain logistics penske logistics appl ,Follow this account for geo-targeted Supply Chain job tweets in New Jersey Non-Metro. Need help? Tweet us at @CareerArc!,0,240,196,New Jersey,NewJersey S-Chain
62a9fa7f0773fd56d77ef29e,Wed Jun 15 13:27:08 +0000 2022,0,en,0,spreading the risk how european shippers are dealing with supply chain disruptions supplychain transportation,,21,99,329,"Syston, Leicester, UK",Tim Bolam 
62a9fa7f0773fd56d77ef29f,Wed Jun 15 13:27:06 +0000 2022,0,en,1, more questions cryptocurrency how does affect its blockchain amp supplychainvisibilty use technology ,Supply Chain/Logistics consultant & advisor. I draw on real end-to-end SCM experience. Penn Stater. Ice coffee drinker. I agree with me. Email: tomc@ltdmgmt.com,61099,1371,740,"Lehigh Valley, PA",Tom Craig
62a9fa7f0773fd56d77ef2a0,Wed Jun 15 13:24:24 +0000 2022,0,en,0, line with ensuring businesses have sustainable supply chain encouraging the use wind energy example ,Providing Sustainability and Social Responsibility Solutions,305,711,1180,London,Responsible Futures
62a9fa7f0773fd56d77ef2a1,Wed Jun 15 13:23:57 +0000 2022,0,en,0, have supplychain jobs open today memphis check them out via the link our bio ,"Follow this account for geo-targeted Supply Chain job tweets in Memphis, TN. Need help? Tweet us at @CareerArc!",0,256,196,"Memphis, TN",Memphis S-Chain
62a9fa7f0773fd56d77ef2a2,Wed Jun 15 13:23:07 +0000 2022,0,en,0, kraton corporation are passionate about making the world better place matter your role kraton ever ,"Follow this account for geo-targeted Supply Chain job tweets in Jacksonville, FL. Need help? Tweet us at @CareerArc!",0,246,199,"Jacksonville, FL",Jacksonville S-Chain
62a9fa7f0773fd56d77ef2a3,Wed Jun 15 13:23:05 +0000 2022,1,fr,2,les amp juin lab vivatech vous permet découvrir stratup une ,Pour tout savoir des actualités du groupe #LaPoste ! #Proximité #EngagéePourVous #LaPosteSEngage #Vivatech Service clients : @LisaLaPoste,48331,46148,5754,,La Poste Groupe à #Vivatech
62a9fa7f0773fd56d77ef2a4,Wed Jun 15 13:23:01 +0000 2022,0,en,0,according syed aman founder and ceo fresh produce digital freight platform provider hwy haul digitizing ,The American Frozen Food Institute (AFFI) is the national trade association that promotes the interests of all segments of the frozen food and beverage industry,3679,2315,1801,"Arlington, VA",American Frozen Food Institute
62a9fa7f0773fd56d77ef2a5,Wed Jun 15 13:21:53 +0000 2022,0,en,0,where every employee part the solution has been selected siliconindia one the ,"siliconindia is a US-INDIA Magazine which provides the most relevant content by projecting stories of #entrepreneurs, #Businesses Updates and technology trends.",1157,2741,450,Bangalore,siliconindia
62a9fa7f0773fd56d77ef2a6,Wed Jun 15 13:21:40 +0000 2022,0,fr,1, toujourspresentsnec sur établissement supplychain colomiers nathalie minjon notre régionale ,"Secrétaire Fédéral @CfeCgcAgro. Délégué Syndical National Carrefour @SNEC_CFE_CGC Supply Chain, Sièges et Fonctions Supports",3603,249,145,,Yannick TRICO
62a9fa7f0773fd56d77ef2a7,Wed Jun 15 13:20:48 +0000 2022,0,en,0, gas flows from russia gazprom italy are down around compared with the previous day ukraine soviet ,Live today plan for tomorrow due diligence. Not an advisor. Do your own DD before investing in any asset class or security. #World #News Thank you for the RTs,3072,1512,5001,,XO
62a9fa7f0773fd56d77ef2a8,Wed Jun 15 13:20:08 +0000 2022,0,en,1, retail amp inventory overstock supplychain logistics the person who stole place line warning you ,Supply Chain/Logistics consultant & advisor. I draw on real end-to-end SCM experience. Penn Stater. Ice coffee drinker. I agree with me. Email: tomc@ltdmgmt.com,61099,1371,740,"Lehigh Valley, PA",Tom Craig
62a9fa7f0773fd56d77ef2a9,Wed Jun 15 13:19:18 +0000 2022,3,fr,1, toujourspresentsnec sur établissement supplychain colomiers nathalie minjon notre régio ,Coordinateur Syndical Central Supply Chain,518,100,141,"Istres, France",BOULSA Biga Thierry
62a9fa7f0773fd56d77ef2aa,Wed Jun 15 13:18:46 +0000 2022,0,en,0,see our latest northsmithfield supplychain job opportunity and click the link our bio apply warehouse ,"Follow this account for geo-targeted Supply Chain job tweets in Providence, RI. Need help? Tweet us at @CareerArc!",0,244,202,"Providence, RI",Providence Schain
62a9fa7f0773fd56d77ef2ab,Wed Jun 15 13:18:36 +0000 2022,0,en,0, sap ariba sourcing provides best class solution with prominent and tangible results which makes sourcing ,Global Partner Of Choice For SAP Requirements.,55,316,549,"35 New Broad Street, London,UK",AmDhan Ltd. UK.
62a9fa7f0773fd56d77ef2ac,Wed Jun 15 13:18:21 +0000 2022,1,en,0,despite supplychain challenges geopolitical tensions and other hurdles global semiconductor executives are confi ,"Technology, Media, and Telecommunications sector leader for @KPMG_US. 
Views expressed are my own.",99,115,390,,Mark Gibson
62a9fa7f0773fd56d77ef2ad,Wed Jun 15 13:18:16 +0000 2022,0,en,0,can you recommend anyone for this job material handler shipping supplychain nowhiring,"Whatever your talents, goals and ambitions, you’ll find a distinctive place to thrive at BAE Systems. Follow @BAEsystemsinc for a glimpse of #LifeatBAESystems.",0,2420,3,United States,"BAE Systems, Inc. Jobs"
62a9fa7f0773fd56d77ef2ae,Wed Jun 15 13:17:26 +0000 2022,0,en,0,want work icu medical hiring plymouth click the link our bio for details this job and ,"Follow this account for geo-targeted Supply Chain job tweets in St. Paul, MN. Need help? Tweet us at @CareerArc!",0,237,203,"St. Paul, MN",Minneapolis S-Chain
62a9fa7f0773fd56d77ef2af,Wed Jun 15 13:17:03 +0000 2022,0,en,0,what business can learn from russia ukraine and the semiconductor shortage ,"@VallumSoftware, #EdgeComputing #IoT #ITmonitoring #NetworkMonitoring  #NetworkManagement #msp #software #microservices #containers #surveillancecameras #IIoT",18006,2790,1449,"Atlanta, GA",Lance Edelman
62a9fa7f0773fd56d77ef2b0,Wed Jun 15 13:16:49 +0000 2022,0,en,0,this supplychain job might great fit for you click the link our bio see and more quality assurance ,"Follow this account for geo-targeted Supply Chain job tweets in St. Cloud, MN. Need help? Tweet us at @CareerArc!",0,265,191,"St. Cloud, MN",St.Cloud SupplyChain
62a9fa7f0773fd56d77ef2b1,Wed Jun 15 13:15:28 +0000 2022,1,pt,0, coffeecast desafios logísticos para exportação profissionais supplychain enfrentam gargaloslogísticos ,Conselho de Exportadores de Café do Brasil,453,998,340,"São Paulo, Brasil",CECAFÉ
62a9fa7f0773fd56d77ef2b2,Wed Jun 15 13:15:25 +0000 2022,0,en,0,lots audits and stock takes are being carried out around the warehouse today ecommerce ecommerceorders ,Haul + Store have a purpose build automated warehouse offering the full range of e-commerce fulfilment services and B2B wholesale solutions.,582,288,694,"Camberley, South East",Haul + Store
62a9fa7f0773fd56d77ef2b3,Wed Jun 15 13:15:05 +0000 2022,0,en,0,are withhold release orders top mind for your business take minutes learn steps wro response rea ,"Helping businesses source more responsibly to create a healthier, safer, more sustainable world for consumers https://t.co/NIu0oHFW9S",1295,1591,1276,"Boston, MA",Transparency-One
